{
 "add_total_row": 0,
 "columns": [{
   "fieldname": "NULL",
   "fieldtype": "Data",
   "label": "Type_Cd",
   "width": 0
  },
  {
   "fieldname": "Invoice_Number",
   "fieldtype": "Link",
   "label": "Invoice_Number",
   "options": "Sales Invoice",
   "width": 0
  },
  {
   "fieldname": "Invoice_Date",
   "fieldtype": "Date",
   "label": "Invoice_Date",
   "width": 0
  },
  {
   "fieldname": "HSN",
   "fieldtype": "Data",
   "label": "HSN",
   "width": 0
  },
  {
   "fieldname": "Make",
   "fieldtype": "Data",
   "label": "Make",
   "width": 0
  },
  {
   "fieldname": "UQC",
   "fieldtype": "Data",
   "label": "UQC",
   "width": 0
  },
  {
   "fieldname": "Item_Name",
   "fieldtype": "Data",
   "label": "Item_Name",
   "width": 0
  },
  {
   "fieldname": "Qty",
   "fieldtype": "Float",
   "label": "Qty",
   "width": 0
  },
  {
   "fieldname": "Rate",
   "fieldtype": "Currency",
   "label": "Rate",
   "width": 0
  },
  {
   "fieldname": "Amount",
   "fieldtype": "Currency",
   "label": "Amount",
   "width": 0
  },
  {
   "fieldname": "Currency",
   "fieldtype": "Data",
   "label": "Currency",
   "width": 0
  },
  {
   "fieldname": "Bond_Rebate",
   "fieldtype": "Data",
   "label": "Bond_Rebate",
   "width": 0
  },
  {
   "fieldname": "Basic_Value",
   "fieldtype": "Currency",
   "label": "Basic_Value",
   "width": 0
  },
  {
   "fieldname": "Other_Charge",
   "fieldtype": "Data",
   "label": "Other_Charge",
   "width": 0
  },
  {
   "fieldname": "Bill_Value",
   "fieldtype": "Data",
   "label": "Bill_Value",
   "width": 0
  },
  {
   "fieldname": "Taxable_Value",
   "fieldtype": "Data",
   "label": "Taxable_Value",
   "width": 0
  },
  {
   "fieldname": "IGST",
   "fieldtype": "Currency",
   "label": "IGST",
   "width": 0
  },
  {
   "fieldname": "CGST",
   "fieldtype": "Currency",
   "label": "CGST",
   "width": 0
  },
  {
   "fieldname": "SGST",
   "fieldtype": "Currency",
   "label": "SGST",
   "width": 0
  },
  {
   "fieldname": "Inv_Value",
   "fieldtype": "Currency",
   "label": "Inv_Value",
   "width": 0
  },
  {
   "fieldname": "GST_total",
   "fieldtype": "Float",
   "label": "GST_total",
   "width": 0
  }],
 "creation": "2023-11-30 18:57:28.213610",
 "disabled": 0,
 "docstatus": 0,
 "doctype": "Report",
 "filters": [],
 "idx": 0,
 "is_standard": "Yes",
 "letterhead": null,
 "modified": "2023-11-30 18:57:28.213610",
 "modified_by": "Administrator",
 "module": "Ambika Accounts",
 "name": "HSN Wise Summery Detailed",
 "owner": "Administrator",
 "prepared_report": 0,
 "query":"SELECT\n    NULL AS Type_Cd,\n    si.name AS Invoice_Number,\n    si.posting_date AS Invoice_Date,\n    siuom.gst_hsn_code AS HSN,\n    i.item_group AS Make,\n    siuom.uom AS UQC,\n    siuom.item_name AS Item_Name,\n    siuom.qty AS Qty,\n    siuom.rate AS Rate,\n    siuom.amount AS Amount,\n    si.currency AS Currency,\n    NULL AS Bond_Rebate,\n    si.total AS Basic_Value,\n    NULL AS Other_Charge,\n    NULL AS Bill_Value,\n    si.total AS Taxable_Value,\n    \n    CASE\n        WHEN si.tax_category = 'Out-State' THEN stc.base_tax_amount\n        ELSE NULL\n    END AS IGST,\n    CASE\n        WHEN si.tax_category = 'In-State' THEN stc.base_tax_amount\n        ELSE NULL\n    END AS CGST,\n    CASE\n        WHEN si.tax_category = 'In-State' THEN stc.base_tax_amount\n        ELSE NULL\n    END AS SGST,\n    \n    CASE\n        WHEN si.disable_rounded_total = 1 THEN si.grand_total\n        ELSE si.rounded_total\n    END AS Inv_Value,\n    \n    SUM(stc.rate) AS GST_total\n    \nFROM\n    `tabSales Invoice Item` siuom\nJOIN\n    `tabSales Invoice` si ON siuom.parent = si.name\nLEFT JOIN\n    `tabSales Taxes and Charges` stc ON si.name = stc.parent\nLEFT JOIN\n    `tabItem` i ON siuom.item_code = i.item_code\nWHERE\n    si.docstatus = 1\nGROUP BY\n    si.name,\n    si.posting_date,\n    siuom.gst_hsn_code,\n    i.item_group,\n    siuom.uom,\n    siuom.item_name,\n    siuom.qty,\n    siuom.rate,\n    siuom.amount,\n    si.currency,\n    si.total,\n    si.tax_category,\n    si.disable_rounded_total;",
 "ref_doctype": "Sales Invoice",
 "report_name": "HSN Wise Summery Detailed",
 "report_type": "Query Report",
 "roles": [
  {
   "role": "Accounts Manager"
  },
  {
   "role": "Accounts User"
  }
 ]
}